,Tweet,Message,Match,Polarity
943,944,PamHrick RobCenta WashMystics De11eDonne Hi pam looks like uve not seen the news wnba team to toronto is not happening  u shudnt support them retweeting ur tweet they r known scam,"['like', 'support']",POSITIVE
944,945,Got7zangel Hmmm As long as you dont mind paying for the postage from US to Canada Im willing to help you,['willing'],POSITIVE
945,946,zeebra03 AndrewScheer jonasjsmith Theyre the Canadian Rangers largely made up of Canadas northern indigenous Your sloth in not doing some basic research and your insulting words to a proud group of people is an argument against your being able to vote,"['sloth', 'insulting']",NEGATIVE
946,947,Were testing a feature to hide replies from conversations This experience will be available for everyone around the world but at this time only people in Canada can hide replies to their Tweets  We want to know what you think Please Tweet us your feedback and questions ,['available'],POSITIVE
947,948,Basically as you can read in this RalphGoodale op-ed  Trudeaus election strategy includes trash-talking Canada -- a huge change from Jean Chretien declaring this to be the best country in the world  cdnpoli,['best'],POSITIVE
948,949,The night before the pair were found dead they were seen talking with a man in the middle of the highway who looked frustrated ,"['dead', 'frustrated']",NEGATIVE
949,950,Where  Are you kidding  Are you watching PTV lady  See an ocean of people who are cheering PMIK20000 people in the arena in Washington who have travelled from all over us and Canada to WELCOME the PM WE SELECTED go see if you can gather 200 ,-,NEUTRAL
950,951,camj1953 mmjblair IreneSc10551404 Eames74932988 whizzbill ToALouse nevsprada athomsonkinross JanetMcwee alcampian carmic3 Jacamo PaulMcM78 policescotland Welll the article in original tweet is about uk amp Scotland someone else mentioned Canada however I do apologise I will butt out thanks,-,NEUTRAL
951,952,Kamloops researchers develop software to help prevent lone-wolf shooter attacks  CBC News  ,['attacks'],NEGATIVE
952,953,Did you know that in Canada the estimated direct and indirect costs of ChronicPain total 56 to 60 billion per year In their first report the CanadianPainTaskForce calls for changes to pain care education and research  TakingActionOnPain ,['pain'],NEGATIVE
953,954,How do Muslims cope with anti-Muslim bigotry especially when it goes official Read about it in The Relevance of Islamic Identity in Canada edited by Nurjehan Aziz nonfiction essays criticism ,"['bigotry', 'criticism']",NEGATIVE
954,955,ninaturner davidsirota MSNBC BernieSanders Didnt Bernie take a group of mostly female Vermonters into Canada for cheaper Breast Cancer drugsHe sounds horrible for women I cant stand how MSM is constantly crapping all over Bernie amp his messageHe could save someones life amp theyd find a way to complain about him,"['horrible', 'complain']",NEGATIVE
955,956,Someone say with a straight face that the US is in better shape then Canada at the moment ,['better'],POSITIVE
956,957,Brexit news UK trade envoy quits in protest over no-deal policy threatening 800m Canada agreement - The IndependentMore good news then  mrjamesob are you headlining Mondays gig with this ,"['protest', 'threatening']",NEGATIVE
957,958,Prime Minister Trudeau Ban Huawei from Canadas 5G telecom networks Stop Telus Bell and others from partnerships that harm our National Security - Sign the Petition  via CdnChange,['harm'],NEGATIVE
958,959,Today in 1915 HMCS Canada was commissioned in service,-,NEUTRAL
959,960,Some ION stations are unsafe and inaccessible accessibility consultant says  ,['unsafe'],NEGATIVE
960,961,gonzalezgabbiee come to canada thanks,-,NEUTRAL
961,962,Why mad places be having shitty or sold out drink selections but always got water and Canada Dry like anyone asks for that,-,NEUTRAL
962,963,Canada sends message to Igbos living in country ,-,NEUTRAL
963,964,oh my god canada might elect a dude named Butts to run their country SMH,-,NEUTRAL
964,965,The Game Is Ending Thank You For Playing-- ,-,NEUTRAL
965,966,Were speaking with Barbara Perry Director of the Centre on Hate Bias and Extremism at Ontario Tech University She has been researching the growth of right-wing extremist groups in Canada and says the threat is greater than most people realize ontariotechu,"['extremist', 'threat']",NEGATIVE
966,967,A self portrait Jungwoon Kim  saatchiart jungwoonkim ,-,NEUTRAL
967,968,sinsimo I love it  hi from Canada,['love'],POSITIVE
968,969,Street nurse decries lack of cooling centres during Torontos hottest day of summer  ,-,NEUTRAL
969,970,On 3-MondayTuesdayWednesday,-,NEUTRAL
970,971,Canada has own TrollsAttackers Jeff Ballingall of ONProud made own attacksamp also had Troll armies on Facebook amp TwitterHe now has CanadaProud groups to get PMJT like they got Wynne ,['like'],POSITIVE
971,972,Cant watch love island in Canada so If anyone wants to find a way to help me pls do,['love'],POSITIVE
972,973,Dr Yoni Freedhoff a professor at the University of Ottawa who specializes in obesity said that the only explanation for Scheers comments which he described as intensely stupid is that they are meant to curry political favour ScheerDesperation ,-,NEUTRAL
973,974,You Got To Play Your Cards Right  Dropping New Shit All Year Get Ready WorldwideInternational ExplorePage Silento NewMusic HipHop Rap RnB Atlanta California Brazil Detriot Canada Paris USA  ,-,NEUTRAL
974,975,THIS is how we do things in Canada right JustinTrudeau Attawapiskat whereisSeamus UselessMinister LiberalShame cdnpoli onpoli ,['right'],POSITIVE
975,976,Here are my thoughts on how much Canada has changed in the past few years because of trans ideology If anyone wants me to share the articles that I cited on FB please let me know and Ill post them below ,-,NEUTRAL
976,977,autopsy87 Canada does not want Minnesota so dont offer it to us,-,NEUTRAL
977,978,Trudeau Liberals simply cant speak the truth The only way they won in 2015 was to lie to Canadians to get elected amp did everything possible to destroy CanadaSadly people STILL trust this LIAR Soon they will all learn the hard way,"['lie', 'destroy', 'hard']",NEGATIVE
978,979,Id rather talk about Michelle Rempels American husband trashing Canada franklyShall we Lets ,-,NEUTRAL
979,980,Cruising Trans Canada hwy on Google maps and I spot this some things cant be explained ,-,NEUTRAL
980,981,Meet the guy who trolls phone scammers until they ask him to stop calling  feet on keyboard to,-,NEUTRAL
981,982,MaryJohanna6 LaurieGarrett POTUS realDonaldTrump Trump was a Democrat when he was deferred Almost all dodgers at that time were Democrats Everyone who consulted lawyers like Bill kunstler or who fled to Canada were wealthy Democrats Per usual Democrats were unpatriotic and useless,"['like', 'wealthy']",POSITIVE
982,983,ipekalara LPLive mikeshinoda ChesterBe thanks im from canada so i cant see likes ,['likes'],POSITIVE
983,984,Social media but not video games linked to depression in teens according to Montreal study ,['depression'],NEGATIVE
984,985,Rainha3lq5 i believe theres usually an expiry on the pass depending on ur condition And yeah auto insurance monthly US cheaper insurance than canada,['cheaper'],POSITIVE
985,986,Brandon Drury just caught on the video board singing along to O Canada if youre looking for candidates for your favourite BlueJays player of the day,-,NEUTRAL
986,987,Pkgman60 mitigirl GOP RepRonEstes SpeakerPelosi Trump isnt worried about you If he were hed insist on a fair playing field Hed negotiate in good faith too something both Mexico and Canada say hes not doing Both countries have reported they are moving towards other markets because Trump isnt trustworthy,"['fair', 'good', 'faith', 'trustworthy']",POSITIVE
987,988,IsabellaBardoel CailinasEirinn She serves Canada and her constituents better then almost any other MP of any party   do some research before you spout off next time,['better'],POSITIVE
988,989,Is the US facing a growing terror threat   now from Canada  via TheNationalUAE,"['terror', 'threat']",NEGATIVE
989,990,Canada USA use developing countries to dump waste plasticwaste RightOnCanada BaselAction brsmeas HEJSupport ,"['dump', 'waste']",NEGATIVE
990,991,If you could switch lives with a politician for a day anywhere in the world who would you pick and why  Trudeau bcs he studied in mcgill D andd he is from the liberal party plus its canada and and and they like him like u got n ,['like'],POSITIVE
991,992,The more she and other Conservatives trash Liberal Canada the more the base solidifies their support behind CPC ,-,NEUTRAL
992,993,Exactly You got very private parents You dont know a name Because Laura could have been a fake name The girl is a minor And further than that All that is known is she was from Canada ,['fake'],NEGATIVE
993,994,Davidls6 She came in October 1991 on the Royal yacht Could be Canada,-,NEUTRAL
994,995,PEI artists receive 50K in grants from province ,-,NEUTRAL
995,996,BillOReilly There were open borders in 1845  Anyone could come if they could book passage You deny others the privilege you directly benefited from Irish immigrants also immigrated to England Scotland Wales Canada amp Australia during the famine They werent forced to come to America,"['deny', 'famine']",NEGATIVE
996,997,we in canada ,-,NEUTRAL
997,998,Five ways the US heatproofs 50C cities  ,-,NEUTRAL
998,999,Been a fan of SimuLiu since season one of KimsConvenienceso proud to hear Marvels ShangChi announcement Congrats dude and continue making Canada proud ,['proud'],POSITIVE
999,1000,asifintoronto PattyOLimerick Ever since marrying her totally amazing US military husband the Canada bashing makes more and more sense she really doesnt want to be here,-,NEUTRAL
1000,1001,Retweet if youreGayBiLesbianStraightA boyA girlAn alienA fairy god parentA spongeA psychotic serial killerNo one will ever know which one you are ,-,NEUTRAL
1001,1002,This is the new Canada TrudeauMustGo  ButtsMustGo ,-,NEUTRAL
1002,1003,wordmixrr monizahossain I guess because America is Canadas neighbour we use the American usage of quite Or at least thats how Ive always interpreted it being used by others as well as myself Reading body language helps as well,['well'],POSITIVE
1003,1004,Racism in Canada is often excused with its worse everywhere elseThats like an abusive partner telling you Im the best youll ever have ,-,NEUTRAL
1004,1005,Canadabuster Where do you live Do you even live in Canada Is English or French your first language Did you read this article Why are you on Twitter What is your aim with your posts You really sound like quite the derp,['like'],POSITIVE
1005,1006,Ad eBay Air Bag Sedan Canada Market Front Passenger Door Fits 01-05 BMW 320i 90046  ,-,NEUTRAL
1006,1007,Interesting difference BC Liberal Govt refused to employ a forester who wanted to protect forests NDP continue employ of ex Fraser Institute guy Fazil Mihlar who spent years attacking the very need for functioning governments bcpoli,-,NEUTRAL
1007,1008,SarahChampionMP Studies from Sweden and Canada highlighted that criminalisation of clients does  not improve access to services nor reduce violence against sex workers 28,['improve'],POSITIVE
1008,1009,tHeRe IsNt FoReIgN iNtErFeReNcE iN cAnAdA eLeCtIoNs ,-,NEUTRAL
1009,1010,Japanese Canadians call on BC to go beyond mere apology for historic racism ,['racism'],NEGATIVE
1010,1011,Justin Trudeau is more interested in being loved by Hollywood celebrities than standing up for Canadian families He once tweeted out a 50 million donation just to impress TV personality Trevor Noah Canadas Conservatives are focused on doing whats right by taxpayers ,"['loved', 'impress', 'right']",POSITIVE
1011,1012,LEGALIZE CANNABIS WORLDWIDE MMJ GANJA LEGALIZEIT LEGALIZEAMERICA LEGALIZE HEMP SMOKEWEED CBD THC KEEPITHERBAL GREENTEAM GREENCLOUD USA CANADA bIZ mONEY HEALTHCARE SCIENCE MOTHERNATURE EARTH NATURAL oRGANIC MEDICINE PLANTS,-,NEUTRAL
1012,1013,4rehctipeca AmandaStingWCW WWE One can even envision a NXT USA and NXT Canada Survivor Series style tag match Make for some great TV TripleH,['great'],POSITIVE
1013,1014,All of Canada is in a heat wave except Alberta and I just wanna know if were being punished for voting Kenney in,-,NEUTRAL
1014,1015,Cambodia to Return 1700 Tons of PlasticWaste to US Canada   PlasticPollutes PlasticOceans,-,NEUTRAL
1015,1016,UFC240 this Saturday in Canada - 140 profit with my PREMIUM package at UFCSanAntonio - 7 Premium bets land - 70 on picks since June 1st even with all the underdogs winning  Like this tweet to receive free picks via DM  DM for Premium RTs appreciated,"['winning', 'free', 'appreciated']",POSITIVE
1016,1017,Trump keeps on insisting that the USA as no need to be concerned about climate change ,['concerned'],NEGATIVE
1017,1018,CanadianZero cgb2077 CorelRister MorganeOgerBC PAngebrandt mikeatrix VenomousGramma RickRMehta RyanSmyth GayleneSass MaximeBernier votejkent mannyottawa LauraLynnTT peoplespca this alleged child abuse is misdefined + use of state force backs up the threat to abduct ones children it seems to be part of the new socialist agenda now but historically state child abduction happened in non-socialist regimes too ex residential school abuse in Canada,"['abuse', 'threat']",NEGATIVE
1018,1019,unrealAnnaAdams I guess ladies getting their balls waxed in Canada is going to be a human right ,['right'],POSITIVE
1019,1020,CHENLE IS TRENDING IN CANADA YES BBY LETS GET IT WE LOVE YOU PRESIDENT,-,NEUTRAL
1020,1021,Moisturize this Summer with Highs Canada Hand amp Foot MasksGet Yours Today highscanada highsbeauty homespa glowing skin glowingskin beauty skincare prettyhands handmask beautiful moisturize replenish cracked chapped summertime summer ,"['glowing', 'beauty', 'beautiful']",POSITIVE
1021,1022,No security upgrades to any churches across Canada but this Ottawa commits nearly 15000 for security upgrades at Halifax mosque ,-,NEUTRAL
1022,1023,Geoffrey Canada says that schools should combine educational social amp medical services to create a web within the community that empowers each student amp prepares even the youngest for their education journey to college amp beyond NASSP PrincipalsConf NPC19,-,NEUTRAL
1023,1024,ItsCapiii3 Canada Love Canadahate Timmy hoes,-,NEUTRAL
1024,1025,Theres nothing exemplary about a man who rapes an unconscious woman I dont give a fuck about this rapists resume report the goddamn news  ,-,NEUTRAL
1025,1026,MacLeodLisa CdnTulipfest ExploreON Hooker said organizers felt puzzled and devastated when they didnt receive the 100000 grant which the festival received over the previous five yearsHooker found out about the news about the partial re-funding Saturday morning from CBC ,"['puzzled', 'devastated']",NEGATIVE
1026,1027,Airbnb has removed approximately 31000 homes from Canadas long-term rental supply The commercialization of short-term rental operations has a profound impact on the supply of affordable housing Voice your concerns at  FairRules Elexn43 ,"['profound', 'affordable']",POSITIVE
1027,1028,Washington DC - more than 20000- people from USA and Canada have gathered to listen to PM Pakistan Imran Khan  ,-,NEUTRAL
1028,1029,barstoolsports OldRowOfficial In Calgary Canada we got this pedal barfutureishere ,-,NEUTRAL
1029,1030,dyer440 aeberman12 Schwerepunkt But if HH goes above 4 there is a lot of volume in the Marcellus that will be happy to drill with those prices and - even further - you might even see volumes from Canada come down if prices ever reached 5 consistently,"['happy', 'consistently']",POSITIVE
1030,1031,grannycindy57 magiver1001 Michell82410861 philrack CanArm2011 alschmucko OtagoGrad NewImproved9 HaveWeAllGoneM1 calybo62 AllThySons01 JohnAll63815927 marckovvvvv DestinyParadigm ITSLIISA PpcYukon HedinBill MaelColum DaneMckerness ThedeplorableM AGRichard1 munch289 Charlie55017434 palevell thereds8 leighgt jmclennan8 traceitback MarkMe60 anna938 CapersQ RachieBabe079 trishshirlaw PaulSR36855907 RickRed10 jeffg463 Cherylscotian1 Orkidnut RickClarke2017 Lyndamathews25 sideshowbo JanieStK GayleneSass SaskLass SusanIverach pat69817036 boysha canadarj nixinixon wendyfanning More LibCon word salad  Trump said nothing divisive  Only in 2019 is it considered divisive  Thank God the LibCon era of pandering and identity politics is coming to an end,"['divisive', 'pandering']",NEGATIVE
1031,1032,We love you 3000 and heres a contest to prove it Follow us + RT to enter to win a copy of Marvels AvengersEndgame available on Blu-ray August 13th Canada only ,"['love', 'win', 'available']",POSITIVE
1032,1033,President Trump let me apologize for all of my fellow Canadians who send you idiotic tweets as here in Canada we should worry about our own countryour PM is the worst and we have no business tweeting you,"['idiotic', 'worry', 'worst']",NEGATIVE
1033,1034,canada has some cute boys,['cute'],POSITIVE
1034,1035,A lot of us are born and raised here Canada is home for us Just because we wear religious symbols does not mean were different we do belong here says Chaachouh,-,NEUTRAL
1035,1036,This just in Heres what the Department of Education said off-the-record about Canada Kanyes music destroyed the process behind creating,-,NEUTRAL
1036,1037,Kinks - All Day And All Of The Night 1965   kbradiothp internetradio,-,NEUTRAL
1037,1038,One in five Canadians lives with chronicpain The CanadianPainTaskForce will identify best practices to improve healthoutcomes of Canadians living with chronicpain  ,"['best', 'improve']",POSITIVE
1038,1039,Have your say Make sure youre registered to vote You can register online now with Elections Canada or update your registration if you have recently moved ItsOurVote,-,NEUTRAL
1039,1040,Young victims of deadly Danforth shooting to be remembered today at vigil ,['deadly'],NEGATIVE
1040,1041,munch289 TrudeauMustStay after all any Government that would support Racist  and Chauvinist pig like Doug Ford   should not be running Canada,"['support', 'like']",POSITIVE
1041,1042,Both monkey goby Neogobius fluviatilis and round goby Neogobius melanostomus are invasive in US and Canada but here in Europe they are native  I ended up collecting 7 gobies total  3 round gobies and 4 monkey gobies    ,['invasive'],NEGATIVE
1042,1043,Guy Paul Thibault gpthibault - KB Radio Shoutout,-,NEUTRAL
1043,1044,First moon landing World celebrates 50th anniversary of Apollo 11 ,-,NEUTRAL
1044,1045,One man dead after 20-person street brawl in Montreal  ,['dead'],NEGATIVE
1045,1046,GOP SecretaryRoss About time Speaker N Pelosi put it to a vote we need this its great for United States Mexico and Canada USMCA Democrats need to do their Job pass this if they really care about America,['great'],POSITIVE
1046,1047,craigmarkly KevinShipp neiltyson Should Canada deport their bald eagles,-,NEUTRAL
1047,1048,Christ even I had to study that report as part of standard reading in a course on contemporary FNs issues in Canada as taught by the late Marie Small Face Marule at the U of Lethbridge in the 1980s It starts there  A further early read would be Leroy Littlebears writing ,['issues'],NEGATIVE
1048,1049,Ted Cruz comes down here from Canada and tells us how to run our government If he does not like it here he can go back,['like'],POSITIVE
1049,1050,OilsandsAction You can be proud of the Oil Sands and Proud about Environment same time Lots of liberalparty people work in the Oil Sands We can do both should be asking why the Oil rich companys dont do more for there communitys in Canada,"['proud', 'work', 'rich']",POSITIVE
1050,1051,Meet Canadas newest boy band 50 Shades Of Vanilla cdnpoli cdnmedia ,-,NEUTRAL
1051,1052,As far as I know Canada the UK and other international platforms will remain unchanged but Im checking with my bosses on that as I dont yet know for sure yes I have bosses Stay tuned for more info TheOrville ,-,NEUTRAL
1052,1053,WellBuiltStyle 8 mature plants per person now in Canada8 You can cultivate for non resale but for personal domestic consumption8 ,['mature'],POSITIVE
1053,1054,Trapped spawning salmon to be flown over Fraser River rock slide in BC ,-,NEUTRAL
1054,1055,Crossing the border illegally in Canada5000 fineCrossing the border illegally in Iran8 years in prisonCrossing the border illegally in North KoreaYou get shotCrossing the border illegally in the USYou get free healthcare free college amp a drivers license,['illegally'],NEGATIVE
1055,1056,NASA ESA NASA Canada Japan and Space-X and ULA should unite to conquer Mars Also I would add China but nobody wants to hear that,-,NEUTRAL
1056,1057,MISStiffanyMA In Canada all we are extremely violent snow and ice storms,['violent'],NEGATIVE
1057,1058,In 10 days MaximeBernier our next Prime Minister of Canada will be in Saskatoon Come join us for some BBQ and a whole lot of truth yxe Saskatoon Saskatchewan ,-,NEUTRAL
1058,1059,Great articlenot to mention Canada is now ONE TRILLION in debtthanks in great part to these two UN supporting parties they took Canada from a surplus from the harper government to a triilion in debt in 4 yrsand counting as trudeau is buying votes ,"['great', 'supporting']",POSITIVE
1059,1060,TheNatlInterest Venezuela was nowhwre near being real socialism Venezuela has always been a corrupt country Plus the government is involved in drug trafficking Also look at Canada We have a social democracy and were doing just fine,-,NEUTRAL
1060,1061,carolecadwalla Airs in Canada July 24 Cant wait I so respect and appreciate your courage and what youre doing Carole  Stay safe,"['respect', 'appreciate', 'courage', 'safe']",POSITIVE
1061,1062,kimDrysdale Oh wow It sounds like moving there was a way to have a fresh startI know this is a loaded question but is there a big difference between Canada and the US I know it depends on whereOh wow Im sure that would be a lot of fun,"['wow', 'like', 'fresh', 'fun']",POSITIVE
1062,1063,Ontario Proud hired the Conservative Party of Canada campaign chairman Hamish Marshall to do work for them Hamish Marshall is also founder of Rebel Media Who knows who Canada Proud has hired to do work for them I cannot wait to see their Elections Canada filing cdnpoli  ,['work'],POSITIVE
1063,1064,jimsavage gabster0191 Australia is the most multicultural country in the world which is why we have a lower proportion of MPs in our national legislature with non-European heritage than Canada NZ the UK and USA,-,NEUTRAL
1064,1065,KensingtonRoyal wishing HRH Prince George a very Happy 6th Birthday with much love from everyone in Canada  ,['love'],POSITIVE
1065,1066,ResourceWorks 10 alsoCollectively the worlds top 15 CO2 emissions-generating countries are responsible for 72 of global CO2 emissionsAlso consider that in terms of FF produced Canada is top 5 and top 3 in reserves We have massive responsibility for climateaaction cdnpoli,['top'],POSITIVE
1066,1067,Tell Justin to go back to Canada ,-,NEUTRAL
1067,1068,Investigators are suspicious after American woman and her Australian boyfriend were killed on Canada road trip  ,"['suspicious', 'killed']",NEGATIVE
1068,1069,BootstrapCook I would be amazed if this doesnt exist in America or Canada  I will investigate,['amazed'],POSITIVE
1069,1070,Michelle Rempel proves what we have always known She hates Canada SendHimBack ,-,NEUTRAL
1070,1071,gmbutts You are dangerous to Canada as a Liberal Party elite you are firmly convinced that entitles you to pick and choose what laws to follow and what laws to ignore You do not comprehend that our laws apply to you and your party and it is wrong to bypass them for personalparty gain,"['dangerous', 'ignore', 'wrong']",NEGATIVE
1071,1072,DMillardHaskell peoplespca Canadas population has increased by 12 million in the last twenty years exactly why do we need more immigration to sustain population,-,NEUTRAL
1072,1073,CBC More fake news on faker news To confuse the voter DONT TRUST ANYTHING FROM CBC Why polls still matter - even when they cant agree ,"['fake', 'confuse']",NEGATIVE
1073,1074,pickeringpaul RachelleRempel PattyOLimerick Canadians are dull perpetuating the myth of a 0 price tag for health care in Canada In fact Canadians pay more than  because socialist bury the cost deep in their taxes,"['dull', 'myth']",NEGATIVE
1074,1075,Will federal leaders back the legal challenge to Quebecs religious symbols ban bnaibrithcanada believes they should   via CBCCanada Bill21,-,NEUTRAL
1075,1076,Seriously considering moving to Canada after graduation Montreal specifically It really seems to offer everything Im wanting and needing Must consider more in depth,-,NEUTRAL
1076,1077,If my simpleton math holds out then people in Canada have nothing to be complaining about lif ooking to Cali as a benchmark ,['complaining'],NEGATIVE
1077,1078,What kind of Canada do you wantRT this video using trudeaumustgo ,-,NEUTRAL
1078,1079,RyanToronto DebTood TorontoStar CTVNews globeandmail GlobalNational VassyKapelos EvanLSolomon The only hostile ideology is Trudeaus admiration for basic dictatorships  His assault on free speech His never ending antics embarrassing Canada,"['hostile', 'assault', 'embarrassing']",NEGATIVE
1079,1080,StephenPunwasi see the video feedthey followed him in to assess him no doubti say just run these greaseballs  over a few times,-,NEUTRAL
1080,1081,Hi my names are olatunji yemi a Nigerian professional squach player with 34 medals 20 GOLD I have worked hard and competed in SA Zimbabwe UK USA Canada etc please I need sponsorship  kindly help retweet  to create AWARENESS Nike PepsiNaija MTNNG redbull myaccessbank ,"['worked', 'kindly']",POSITIVE
1081,1082,Food Trucks Trailers amp Restaurants Wanted Help us find the best GrilledCheese for Grilled Cheese Festival Oct 4-6  Ottawa City Hall ottawastart canada NarcityCanada  OttawaTourism FoodNetworkCA Foodie myottawa ottcity  grilledcheesefestival ,['best'],POSITIVE
