,Tweet,Message,Match,Polarity
533,534,If you want oil and gas companies writing Canadas environmental protection and climate emergency polices ie the polices that are supposed to protect YOU then AndrewScheer is your guy,"['protection', 'protect']",POSITIVE
534,535,Relief in sight for southeastern Canada following weekend heat wave  ,-,NEUTRAL
535,536,Top 10 In-demand jobs in Canada in 20191 Sales Associate2 Administrative Assistant3 Driver4 Developer5 Receptionist6 Blockchain Developer7 AI Researcher8 Chief Experience Officer CXO9 Live Chat Agent10 Human Resources Officer,-,NEUTRAL
536,537,Carole James seems to be on a mission not just to silence her doubters but to silence every single person who has ever doubted a womans ability to hold and excel at the top job BCpoli ,"['excel', 'top']",POSITIVE
537,538,Today is Day of Inclusion Join me by visiting your local TimHortons TODAY for a Special Olympics Donut- created by SpecialOCanada athlete Tori Ranson All proceeds support athletes like Tori across Canada I proudly ChooseToInclude ,"['support', 'like']",POSITIVE
538,539,JohnIbbitson How about Canadians recognizing their own racism and demanding that boil water advisories be addressed on First Nations as fast as they are in the rest of Canada,"['racism', 'boil']",NEGATIVE
539,540,Music has no boundaries  Canada based NigerianDJ giving them what they need at the right time  NigerianDJ ,['right'],POSITIVE
540,541,LaraLeaTrump We should clarify Nobody is sending anyone anywhere nor wants to We just wish those that promised to move to Canada after Trump was elected actually did A little disappointed At least Clooney tried to move to UK A for effort,-,NEUTRAL
541,542,TomTSEC TheNationalUAE Well when you have a pm that says hey isis Canada is your home Come on home Of course Canada becomes a threat to the US Its as stupid as isis telling western soldiers our war camps are your home An enemy is an enemy is an enemy,"['threat', 'stupid', 'enemy']",NEGATIVE
542,543,Hey WeakAndy AndrewScheer Your MeanGirl Rempel tweeted that her husband bitched about having to be in horrible horrible Canada citing fictional reasons To be succinct she quoted him lying You seem fine with thatBlockedByRempel ,"['horrible', 'fictional', 'lying']",NEGATIVE
543,544,justinbieber realDonaldTrump Go back to Canada piece of shithead go suck at TrudeauJust because you got married doesnt make you a man What Are you going to share your drugs with them Or you are paying them for tattoos with your az ,['suck'],NEGATIVE
544,545,Did you know that 30  of permanent residents in Canada in 2017 didnt speak English or French However key efforts for language immersion are in place as a way to enable their potential WESPicks WESCanada CBIEBCEI CitImmCanada CitImmCanFR EstherTBenjamin CBIEBCEI ,-,NEUTRAL
545,546,TYSM for your vote Our tune October 1 is at 12 after just 3 wks on Canadas  Give us a vote if youve a mind to Caleigh killed it with this one dornermartina WHYmusic sabsbanduk KittenheadLa UnderdogRocks markwinder8 ,['killed'],NEGATIVE
546,547,No surprise AndrewScheer and CPCHQ are bitching without science or evidence to support their claim ,['support'],POSITIVE
547,548,This girl loves Canada summervacation2019 daddyslittlegirl avasofiacox  Green Lake Whistler ,['loves'],POSITIVE
548,549,A new group that claims its watching out for western Canadas interests is actually run by well-connected insiders linked to the provincial Saskatchewan Party WestWatch Saskpoli cdnpoli ,"['interests', 'well-connected']",POSITIVE
549,550,MaMo peacemakerSola Inkotanyi1 Gasana45957520 krissma20 IainCampbell008 LewisMugabe OkuMaazi Johnmugisha1 JRuhinankiko katutsid Rugusuki AsantejnrRuhima jomasseria AlainMucyo1 GianaRenegade KalindaMwene ShimaRwigara VictoireUmuhoza USAmbRwanda JudiRever Judy Rever is just an opportunist trying to make easy personal capital for herselfAfter all her book got 0 validation from any organisation or country including CanadaPhilpot ampRever spent less than 10 days in Rwandaamponly merge past horrors and present-day Rwandan politics,['easy'],POSITIVE
550,551,Asalamo AlaikumFollowing is the menu of the food which will be served during National Ijtima Dates for Ijtima are July 26 27 amp 28Please register now to get blessings from this spiritual gathering Publicity Department National Ijtima AMYA Canada ,['spiritual'],POSITIVE
551,552,Good News Story by BryceHoye Police community homeless group connect with Filipino man Allan Par in hopes of helping him find job home,['helping'],POSITIVE
552,553,LoverOfAnarchy Canada Gosh you really did go far huh she smiled warmly as she hugged her back,['warmly'],POSITIVE
553,554,dwyer93 He was raised in the Dominican Republic and born in french canada,-,NEUTRAL
554,555,CottageLiberal vankayak liberalparty gmbutts You must be so proud of Scheers constant lies and dark toxic plans to dismantle Canada as we know it just to feed his hopelessly deluded ego DisgracefulScheerWeakness ScheerStupidity ScheerNonsense,"['lies', 'dark', 'toxic', 'hopelessly', 'deluded']",NEGATIVE
555,556,The festival chair told CBC organizers felt puzzled and devastated when they didnt receive the 100000 grant which the festival received over the previous five years Funding came but cut by almost 13  ,"['puzzled', 'devastated']",NEGATIVE
556,557,wearebeside TravelAlberta TourismJasper Canada This looks fab Do you have any camp site recommendations,['recommendations'],POSITIVE
557,558,HumanityEqual theJagmeetSingh JustinTrudeau The Conservatives of Canada like the Republicans believe in WhiteSupremacy and hate diversity,-,NEUTRAL
558,559,Who has done more for black people Retweet it and give me a bigger sample Let me see what yall actually know about these folks,-,NEUTRAL
559,560,dwyer93 biggles14 His dad was never a big talker either But of course a Dominican player born in French Canada would be around everything but English,-,NEUTRAL
560,561,DAY OF INCLUSIONVisit your local TimHortons and ChooseToInclude with a purchase of a Special Olympics donut created by SpecialOCanada athlete Tori Ranson 100 of proceeds support Special Olympics athletes across CanadaDayOfInclusion SpecialOlympics ,['support'],POSITIVE
561,562,In his economic speech Scheer never mentions tech or innovation Liberals have done an amazing job attracting the best new economy players to Canada Under a Con government their focus is on the past eg proposed fossil fuel corridorVote Liberal stop the Conscdnpoli ,"['innovation', 'amazing', 'best']",POSITIVE
562,563,Ive been in Canada for 25 days can I add a  to my name yet,-,NEUTRAL
563,564,DelBelaire vankayak liberalparty You must be so proud of Scheers constant lies and dark toxic plans to dismantle Canada as we know it just to feed his hopelessly deluded ego DisgracefulScheerWeakness ScheerStupidity ScheerNonsense,"['lies', 'dark', 'toxic', 'hopelessly', 'deluded']",NEGATIVE
564,565,Calgary father-son duo launch culinary coworking space  CBC News  coworking Ireland plus10org,-,NEUTRAL
565,566,This is what happens due to open Borders Good job Canada ,-,NEUTRAL
566,567,TrudeauMustGo Massively Trends In Canada Desperate Liberals amp Establishment Media Try Blaming It On Bots ,-,NEUTRAL
567,568,It was a terrific week teaching resilience and emotional wellness skills to students entering Grade 9 at Upper Canada Colleges summer Horizons program with AajuPeter Looking forward to bringing this to inuit communities in Nunavut resilience mentalhealth Healing ,['terrific'],POSITIVE
568,569,Willing to donate their organs Colombia 75 India 74 Turkey 72 Brazil 70 Canada 69 UK 67 Italy 66 US 65 China 62 France 57 Germany 53 Saudi Arabia 44 South Korea 39 Japan 33 Russia 30Ipsos 2018,-,NEUTRAL
569,570,Im sorry but I need to understand exactly what he has done to be a strong leader Also he is not respected globally and is the most unethical PM Canada has ever had so I just dont see what you are seeing ,"['sorry', 'unethical']",NEGATIVE
570,571,This item is a must  if you want to target belly fat Visit wwwgotygotyplus com or wwwGotyGoty com wwwGotyGotyusa com to order we offer free shipping in USA  amp Canada   ,-,NEUTRAL
571,572,There are so many TrudeauMustGo tweets circulating in Canada but the reality is that JustinTrudeau should not have been here in the first place notAbot October2019,-,NEUTRAL
572,573,Interested in a job in Toronto ON Canada This could be a great fit Click the link in our bio to apply Support Worker II at Community Living Toronto nonprofit disability,['great'],POSITIVE
573,574,Shopping - CANADAPOST Free Shipping Over 25 at Canada Post No code required Shop Now  MORE AT  PLANETGOLDILOCK AD,-,NEUTRAL
574,575, TECH TALENT COMING TO YQG uwindsor to host cucsc2019Dont miss Industry on Campus  moderated by ACastleWEtech amp featuring experts from Google GSC1957 QuickenLoans amp redpistonOpen to Students Professionals amp IndustryDetails  ,['miss'],NEGATIVE
575,576,DanielMcDonald4 ScienceNotDogma MaximeBernier 400 Nothings changed Trudeau still controls what they can and cannot sayWhy is everything a right or left issue with you guysTo the government there is no right or left just agendaHarper was the one who initiated carbon tax in Alberta ,['right'],POSITIVE
576,577,protectghost okay b hop on over to canada,-,NEUTRAL
577,578,What Is Wrong With People                           Dont call 911 to complain about an ice-cream truck Peel police say ,['complain'],NEGATIVE
578,579,CannibalHoliday MichelleRempel The land of the free puts people away for their crime Unlike canada that lets someone that butcher another with a meat cleaver walk out and get on a plane and leave the country Pathetic,"['crime', 'butcher']",NEGATIVE
579,580,Just realize that I know A lot of thingsNot from Canada but I seen alotta tings ,-,NEUTRAL
580,581,PtCreditVoter ishatreza CPCHQ StellaAmbler RudyCuzzetto AndrewScheer This is exactly why the Prime Ministers official residence on Sussex Drive has been left to rot No government wants to be a accused of spending any money on it even though it belongs to the people of Canada cdnpoli,['rot'],NEGATIVE
581,582,I will be vas happy to live and work in Canada as a Refugees UNHCRCanada since in my country they is no understanding ur following human will hide to enter your dream day and night without visiting or calling send love message ur arrested refugeegender ,"['happy', 'work', 'love']",POSITIVE
582,583,FreeMediaUS THIS is the Canada that I love  THIS is the Canada I am proud of ,"['love', 'proud']",POSITIVE
583,584,Canadas own mediapoliticianspunditslawyersjudges wont rein in our disgraceful human rights commissions I predict withering foreign criticism like rickygervaiss tweetstorm will achieve more than anything our neutered political class will do ,"['disgraceful', 'criticism']",NEGATIVE
584,585,1843 New Brunswick Canada Penny Token  Up for auction coins canadiancoins,-,NEUTRAL
585,586,IMPORTANT EVENT INFOclick the link in bio or visit websiteROUND 4 GP3R 50th Edition of the Grand Prix de Trois Rivire Canada Pre-registration closes 726 secure your pit space now and your name in the ,['secure'],POSITIVE
586,587,From the GOP to the CPCHQ its an absolute myth that the right has superior economic records cdnpoli leftisbest bcndpBC posts 15B operating surplus,"['right', 'superior']",POSITIVE
587,588,Disturbingly Canada DOES think it is a human right for anyone to be considered and treated EXACTLY as the opposite sex if they wantNo one in Canada is legally allowed to acknowledge actual biological sexAnd US House of Representatives just passed a bill saying the same ,['right'],POSITIVE
588,589,Passing through customs at Amsterdam with a  passportCustoms HelloMe hiCustoms stampCan we make it this easy to re-enter Canada please CBSA,['easy'],POSITIVE
589,590,LUCINEPHA pivotalterms amp if you get to Canada take the ferry from Vancouver to Victoria its cheap you might sea some whales,['cheap'],NEGATIVE
590,591,AllThySons01 CanArm2011 JohnAll63815927 philrack marckovvvvv NewImproved9 DestinyParadigm ITSLIISA PpcYukon OtagoGrad HedinBill TheBenKline1 MaelColum DaneMckerness ThedeplorableM AGRichard1 munch289 Charlie55017434 calybo62 palevell thereds8 leighgt jmclennan8 traceitback MarkMe60 Michell82410861 magiver1001 anna938 CapersQ RachieBabe079 trishshirlaw PaulSR36855907 RickRed10 grannycindy57 jeffg463 Cherylscotian1 Orkidnut RickClarke2017 Lyndamathews25 sideshowbo JanieStK GayleneSass HaveWeAllGoneM1 SaskLass SusanIverach pat69817036 boysha canadarj nixinixon wendyfanning Had the problem here in AlbertaMaxs fate will be the sameMaxWho ,['problem'],NEGATIVE
591,592,The disease of political correctness has given room for predators to socially terrorize upstanding citizens The leader of The Peoples Party of Canada is the only one who will dare to call this what it is Disgusting MaximeBernier for Prime Minister 2019 ,['terrorize'],NEGATIVE
592,593,Exclusive Gulf Cartel Leader Caught Sneaking Across Texas Border ,-,NEUTRAL
593,594,Sandwiches were sold in Ontario Quebec and Atlantic Canada ,-,NEUTRAL
594,595,realJd14 AllThySons01 CanArm2011 JohnAll63815927 philrack marckovvvvv NewImproved9 DestinyParadigm ITSLIISA PpcYukon HedinBill TheBenKline1 MaelColum DaneMckerness ThedeplorableM AGRichard1 munch289 Charlie55017434 calybo62 palevell thereds8 leighgt jmclennan8 traceitback MarkMe60 Michell82410861 magiver1001 anna938 CapersQ RachieBabe079 trishshirlaw PaulSR36855907 RickRed10 grannycindy57 jeffg463 Cherylscotian1 Orkidnut RickClarke2017 Lyndamathews25 sideshowbo JanieStK GayleneSass HaveWeAllGoneM1 SaskLass SusanIverach pat69817036 boysha canadarj nixinixon wendyfanning Fildebrandt started his own party in Alberta amp got just 052 of the vote winning 0 seats,['winning'],POSITIVE
595,596,Kate2Spirit PrisonPlanet Sorry Sweet Lady Brits settler the colonies and killed Indiansxand brought black slaves here Brits also continue to treat indigenous people like st in Australia and Canada  that ignores what Brits did in China Africa West Indies and China,"['killed', 'slaves']",NEGATIVE
596,597,I just realized that I spent more time waiting in line at border patrol yesterday than I did sleeping last nightBut was it worth it for A WEEKEND TRIP TO CANADA Absolutely ,['worth'],POSITIVE
597,598,IRONPREFECT December is probably the best time to visit The degeneracy is hidden underneath layers of Canada Goose jackets Unlike now where painted naked people roam free in Washington square park Advice find a good sports bar be a tourist for a while Youll have a good time,"['best', 'free', 'good']",POSITIVE
598,599,BigBootyJudy814 Canada West side,-,NEUTRAL
599,600,mannyottawa realDonaldTrump POTUS Hey mannyottawa tell me if Im wrong NDP  Pro UNIslam -  Cons  Pro UNIslam - Greens  Pro UNIslam - Libs  ProUNIslam  - PPC  Anti UN Pro Canadian Souvereignty  Pro JudeaoChristian  Is that not true - WWG1WGAPPC 2019 for Canada ,['wrong'],NEGATIVE
600,601,Heres my post on three recent rulings of the Supreme Court of Canada dealing with the parameters of police powers in the contexts of an online electronic sting operation police entry on private property as trespassers and a midnight pedestrian shakedown ,['sting'],NEGATIVE
601,602,Justin Trudeau has drawn a historic challenger in Canadas national elections set for October Jagmeet Singh is the countrys first nonwhite contender to lead a major national political party and compete for its top political job ,"['lead', 'top']",POSITIVE
602,603,jettila This is awesome And as soon as Im done tweeting this Im opening the amazon app Cmon amazon Canada dont fail me now,-,NEUTRAL
603,604,Theres no need to worry about an EpiPen shortage according to Health Canada,"['worry', 'shortage']",NEGATIVE
604,605,tugengirl EleazarKenya In Canada you can immigrate on merit not investmentProcess is easy  Express entry program,"['merit', 'easy']",POSITIVE
605,606,When we go back to Canada ,-,NEUTRAL
606,607,matthewasears You can be angry that someone we elected is making Canada sucks jokes with her Trump-supporting American husband without any jingoism fails or nods You can accept that Canada is imperfect and still find this behaviour unacceptable in an elected representative,"['angry', 'sucks', 'fails', 'imperfect', 'unacceptable']",NEGATIVE
607,608,I support Conservative Party of Canada You can download the official app to help out  And give me credit M26X68V,['support'],POSITIVE
608,609,Im tweetingretweeting ANYTHING to do with  WaxMyBalls situation so that people in Canadaamp everywhere elsecan see the effects of Bill C16 as well as effects on womens rights Canadians need to know And with any luck it may help my child avert a serious surgical mistake,"['well', 'luck']",POSITIVE
609,610,Would this burger tempt you to eat meat  ,['tempt'],POSITIVE
610,611,This is what racism and fraud looks like ,"['racism', 'fraud']",NEGATIVE
611,612,September 7th amp 8th 2019 The largest cannabis products expo and competition in Canada Downtown Toronto TheKarmaCup PLEASE CLICK Going Share amp Invite friends  ,-,NEUTRAL
612,613,Only in Canada cc janewells ,-,NEUTRAL
613,614,Apple iPhone and Apple Watch users in Canada have something to look forward to as Apple is preparing to bring Apple Card and Apple Pay Cash to Canada AppleNews  ,-,NEUTRAL
614,615,edwardemery88 lltwing joniernst AOC Is that what happened to Canada Australia The UK,-,NEUTRAL
615,616,TomTSEC spiritcaptain07 Hes answered one of the questions most people ask in Canada when people wonder why they want to be in Canada instead of staying in their Islamic country He said its Freedom of speech here which doesnt put you in jail like their Islamic countries Good post,"['wonder', 'like']",POSITIVE
616,617,Please go to Canada where the white supremacists belong more white people than youve ever seen in your life,-,NEUTRAL
617,618,MarcusEdelstein Live in Canada  but with family in the West MT and the South SC,-,NEUTRAL
618,619,In general there is a lack of awareness around the social determinants of health  Please check those out if you have the time,['lack'],NEGATIVE
619,620,America - Lonely People 1974   kbradiothp internetradio,-,NEUTRAL
620,621,CTVNews Apparently in Canada pressuring demoting then removing from the Party an Attorney General for refusing to interfere with the law that protects prosecutorial independence is not illegal in the Canadian workplace,"['refusing', 'interfere', 'illegal']",NEGATIVE
621,622,Annual ice cream consumptionIndia 01 liters per capitaChina  1 literUK      7 litersItaly    8 litersCanada   11 litersFinland   14 litersAustralia 18 litersUSA        21 liters 56 gallonsUnilever NationalIceCreamDay,-,NEUTRAL
622,623,When I met my nutritionist Michelle Allison fatnutritionist I needed her help in ways I didnt understand She is a registered dietitian who is a member of Dietitians of Canada and ASDAH,-,NEUTRAL
623,624,A handful of Twitter bots created earlier this week tweeted hundreds of times a day to help make the hashtag TrudeauMustGo a national trending topic in Canada a report says ,-,NEUTRAL
624,625,Millionaires as a share of total population 2018 Switzerland 75US 59Canada 14Taiwan 13France 12Japan 11UK 09Italy 08Germany 06China 01Bloomberg,-,NEUTRAL
625,626,Canada Agriculture and Food Museum announces Ice Cream Festival  agriculture bhivenectar bhivelabs bhivechat ,-,NEUTRAL
626,627,World News Spain Morroco EU UK Canada  7 21 19 clip  via YouTube,-,NEUTRAL
627,628,Shudder Will Stream AMCs NOS4A2 in the US and Canada Beginning in August ,-,NEUTRAL
628,629,CANADA Check out my 5-star review on Fiverr This is my new brother I love his work Getting more soon MadeOnFiverr WebAndMobileDesign Fiverr ,"['love', 'work']",POSITIVE
629,630,MadWitticism KristySwansonXO NineLineApparel 2yrs 58 followers even bots think your boring Canada your slogan should be at least were not Greenland I wonder what Canada thinks said no one ever,-,NEUTRAL
630,631,The government of Canada is considering whether to order a woman under force of law to wax a set of cock and ballsHow is forcing a woman to wax a penis and testicles NOT sexual assault ,['assault'],NEGATIVE
631,632,KribbyMortus Franktmcveety Please forward to KinsellaWarren he has blocked me TYLiberal arrogance  that Grit belief that they alone know what is best for Canada and are in fact synonymous with all that is good in Canada  is deadlyImposing that arrogance on Canada is their deadly mission,"['arrogance', 'deadly']",NEGATIVE
632,633,Its certainly time to tell our story and to look at the valuable contributions of African Nova Scotians Still together united Preston Township Homecoming expected to draw thousands by SHBordenColley link  ,['valuable'],POSITIVE
633,634,PattyOLimerick SenatorHousakos This means U of C who is supposed to protect its academic autonomy hired a political operative almost definitively at the insistence of Harper so Harper could take care of his buddy using our money ,['protect'],POSITIVE
634,635,Bird5Ca canadiangirl49 Yeah Liberal progressives are scum on a sicko quest to absolute bottom  Canada does know at least that part of Canada that Trudeau hates that Canada he seeks to destroy knows he has to go TrudeauMustGo ,"['scum', 'hates', 'destroy']",NEGATIVE
635,636,Stonekettle I like hearing different languages here in Canada  Different ethnicities enrich our national identity tapestry,"['like', 'enrich']",POSITIVE
636,637,According to Environment Canada the hot spot in Canada at this hour is Kejimkujik Park NS at 322 C,['hot'],POSITIVE
637,638,KillienJ You cant even get girls in Dubai what makes you think Canada will be any different,-,NEUTRAL
638,639,JohnFurrToronto CharlieDaniels We will happily accept any Americans rational enough to see whats happening to their country and who decide to move on to greener pasturesA heartfelt welcome to Canada,"['happily', 'rational', 'enough', 'heartfelt', 'welcome']",POSITIVE
639,640,Attending yaqeeninstitutes launch in Canada Very insightful and relevant talks by the speakers Recommend everyone to read their work and support them ,"['insightful', 'work', 'support']",POSITIVE
640,641,EVYSTADIUM People need to realize that there is deep seeded racism here in Canada - just like every other country in the world Sure derogatory racist words arent often thrown around in public but where are you from No seriously where are you from is just as bad,"['racism', 'derogatory', 'racist', 'bad']",NEGATIVE
641,642,JamesJandebeur Stonekettle I dont believe nearly anyone from the 24th century would be a fanYeah dudes a right wing radio host in Canada,['right'],POSITIVE
642,643,skipintro AndrewScheer jonasjsmith One can argue the same for all parties Eg Trudeau Srs liberals sought to extinguish all indigenous rights in Canada when Chrtien was minister of INAC The past does not determine the future,['extinguish'],NEGATIVE
643,644,AdamLockett34 dmrider May be this url link,-,NEUTRAL
644,645,BrownsCanada Thanks I wasnt saying Canada ruled Juat that our voting system is different and I believe more fair America is a great countty and I am happy to say that I have many American friends all whom I cherish,"['fair', 'great', 'happy', 'cherish']",POSITIVE
645,646,Skatrgurrl I have taught grade 3 students 8yrs old in Canada who were more articulate had a better vocabulary presented a point of view and spoke more coherently than DT They were all much better people too,"['articulate', 'better']",POSITIVE
646,647,Trying to imagine how the Tory war room would respond if a Liberal or NDP MP tweeted about what a joke Canada iscdnpoli,['joke'],NEGATIVE
647,648,A Historic Contender for Canadas Top Political JobJagmeet Singh the first nonwhite candidate to lead a major national political party in Canada will try to unseat Prime Minister Justin Trudeau ,['lead'],POSITIVE
648,649,13 We said Canada amp NorwayEEA would solve the Irish BorderWE WERE IGNORED,-,NEUTRAL
649,650,1852 Bank of Upper Canada Ontario Penny Token  Up for auction canadiancoins coins,-,NEUTRAL
650,651,Just announced in Hall H at SDCC Marvel Studios BLADE with Mahershala Ali ,-,NEUTRAL
651,652,montesolberg Self-appointed champions of the Canada Food Guide who cant get a sustained supply of clean water to AttawapiskatFraud writ large,['clean'],POSITIVE
652,653,realDonaldTrump This from a man who lied about bone spurs no less to doge his responsibility to serve his country He should have moved to Canada as a conseaecus objetor at least he would have had some moral ground to stand on TrumpDraftDodger,['lied'],NEGATIVE
653,654, Canada end u20 Trophy campaign on a high RugbyCanada rugby RedNation rugbyunited,-,NEUTRAL
654,655,SSBKK Megararagi KrillehW I dont even like Canada man,['like'],POSITIVE
655,656,For the first time Canada adds white supremacists and neo-Nazi groups to its terror organization list ,['terror'],NEGATIVE
656,657,On behalf of the SRS Board of Directors thank you to everyone who attended SRSIMAST19 July 17-20 in Amsterdam We look forward to seeing our members and industry colleagues again in Montreal Canada for the SRS 54th Annual Meeting September 18-21 2019 SRSAM19 ,['thank'],POSITIVE
657,658,I started a conga line on the rooftop of a gay bar in Canada last night I have officially peaked,-,NEUTRAL
658,659,Markham Centre is a thriving mixed use community there is so much to see and do and the Pride of Canada Carousel is a signature piece Created by Canadian-born sculptor Patrick Amiot it pays tribute to our nations most celebrated wonders and icons MarkhamProud ,"['thriving', 'celebrated', 'wonders']",POSITIVE
659,660,avery1twins2 InTimeLiving Suzette300700 GrammaBarbie JoeSilverman7 Right Theyll all go into some other profession they didnt spend years in school for and none of them will want to care fir peoole any more Thats why there are no doctors in Euripe Canada Norway Findlandoh wait,-,NEUTRAL
660,661,Becky Lynch Planning To Beat The Bejesus Out Of Natalya In Canada At Summerslam  ,-,NEUTRAL
661,662,justinbieber realDonaldTrump Go back to Canada,-,NEUTRAL
